{
  "schema_version": 1,
  "event_id": "0190f2a0-b002-7abc-8def-0123456789ab",
  "run_id": "0190f2a0-a001-7abc-8def-0123456789ab",
  "machine_id": "machine_mac_studio",
  "seq": 43,
  "type": "run.succeeded",
  "occurred_at": "2026-07-26T19:46:01.000Z",
  "payload": {
    "exit_code": 0,
    "message": "Run completed"
  }
}
